{
  "version": 1,
  "profileId": "generic-planning-template",
  "setup": {
    "product": {
      "provenance": "caller_declared",
      "value": "Select an authorized cloud application",
      "evidence": []
    },
    "edition": {
      "provenance": "unknown",
      "value": null,
      "evidence": []
    },
    "region": {
      "provenance": "unknown",
      "value": null,
      "evidence": []
    },
    "version": {
      "provenance": "unknown",
      "value": null,
      "evidence": []
    },
    "workspace": {
      "provenance": "unknown",
      "value": null,
      "evidence": []
    },
    "role": {
      "provenance": "unknown",
      "value": null,
      "evidence": []
    },
    "currency": {
      "provenance": "unknown",
      "value": null,
      "evidence": []
    },
    "locale": {
      "provenance": "unknown",
      "value": null,
      "evidence": []
    },
    "timezone": {
      "provenance": "unknown",
      "value": null,
      "evidence": []
    }
  },
  "observationMethods": [
    {
      "kind": "browser",
      "availability": "unknown",
      "notes": "Requires explicit authorized target access; no vendor session has been verified."
    },
    {
      "kind": "api",
      "availability": "unknown",
      "notes": "Optional. Do not infer API access from browser access."
    }
  ],
  "workflows": [
    {
      "id": "first-workflow",
      "question": "Does the selected operation persist after reopening?",
      "goals": ["workflow", "saved_data"],
      "status": "planned",
      "casePath": null,
      "evidence": [],
      "limitations": [
        "No live vendor capture or independent replacement verified."
      ]
    }
  ],
  "externalDependencies": [
    {
      "name": "payments",
      "mode": "untested",
      "scope": "No live effects authorized or exercised by this template.",
      "evidence": []
    },
    {
      "name": "email",
      "mode": "untested",
      "scope": "No live effects authorized or exercised by this template.",
      "evidence": []
    },
    {
      "name": "identity",
      "mode": "untested",
      "scope": "No live effects authorized or exercised by this template.",
      "evidence": []
    },
    {
      "name": "banking",
      "mode": "untested",
      "scope": "No live effects authorized or exercised by this template.",
      "evidence": []
    },
    {
      "name": "hardware",
      "mode": "untested",
      "scope": "No live effects authorized or exercised by this template.",
      "evidence": []
    }
  ],
  "experiments": [
    {
      "id": "fresh-read",
      "workflowId": "first-workflow",
      "uncertainty": "Does the selected operation persist after reopening?",
      "proposedObservation": "Perform the scoped operation on synthetic data, reopen, and inspect the selected values.",
      "status": "planned",
      "evidence": []
    }
  ]
}
